{
  "$schema": "https://json-schema.org/draft/2020-12/schema",
  "$id": "https://wellmanifest.com/schemas/new-project/required-checks/v1",
  "title": "new-project required checks instance",
  "description": "Per-repository required-check declaration. The hub instance may keep workflowFile + requiredCheckNames. Adopters with two workflows use requiredChecks.",
  "type": "object",
  "additionalProperties": false,
  "required": ["schema", "repository"],
  "properties": {
    "schema": { "const": "new-project.required-checks/v1" },
    "version": { "type": "integer", "minimum": 1 },
    "repository": {
      "type": "string",
      "pattern": "^[A-Za-z0-9_.-]+/[A-Za-z0-9_.-]+$"
    },
    "workflowFile": { "type": "string", "minLength": 1 },
    "requiredCheckNames": {
      "type": "array",
      "minItems": 1,
      "uniqueItems": true,
      "items": { "type": "string", "minLength": 1 }
    },
    "requiredChecks": {
      "type": "array",
      "minItems": 1,
      "items": {
        "type": "object",
        "additionalProperties": false,
        "required": ["name", "workflowFile"],
        "properties": {
          "name": { "type": "string", "minLength": 1 },
          "workflowFile": { "type": "string", "minLength": 1 }
        }
      }
    },
    "circularGovernanceChecksIgnoredByValidator": {
      "type": "array",
      "items": { "type": "string", "minLength": 1 },
      "uniqueItems": true
    },
    "externalConsumers": {
      "type": "array",
      "items": { "type": "object" }
    }
  },
  "oneOf": [
    {
      "required": ["workflowFile", "requiredCheckNames"],
      "not": { "required": ["requiredChecks"] }
    },
    {
      "required": ["requiredChecks"],
      "not": {
        "anyOf": [
          { "required": ["workflowFile"] },
          { "required": ["requiredCheckNames"] }
        ]
      }
    }
  ]
}
